citation,prey_taxon,prey_type_add,prey_kingdom_add,prey_phylum_add,prey_subphylum_add,prey_superclass_add,prey_class_add,prey_subclass_add,prey_order_add,prey_family_add,prey_species_add
"Welton, J S., JS, W., & C , M. (1983). Food and habitat partitioning in two small benthic fishes, Noemacheilus barbatulus (lek.) and Cottus gobio L.",a aquaticus,,Animalia,Arthropoda,Crustacea,,Malacostraca,,Isopoda,Asellidae,Asellus aquaticus
"Pothoven, S  ., Madenjian, C. P., & Höök, T. O. (2017). Feeding ecology of the walleye (Percidae, Sander vitreus), a resurgent piscivore in lekake Huron (Laurentian Great Lakes) after shifts in the prey community. Ecology of Freshwater Fish, 26(4), 676-685.",alewife,,Animalia,Chordata,,,Actinopterygii,,Clupeiformes,Clupeidae,Alosa pseudoharengus
"Speirs, G D. (1974). Food habits of landlocked salmon and brook trout in a Maine lake after introduction of landlocked alewives. Transactions of the  merican Fisheries Society, 103(2), 396-399.",alewife,,Animalia,Chordata,,,Actinopterygii,,Clupeiformes,Clupeidae,Alosa pseudoharengus
"Madenjian, C P., Desorcie, T. J., & Stedman, R. M. (1998). Ontogenic and spatial patterns in diet and growth of lake trout in lekake Michigan. Transactions of the  merican Fisheries Society, 127(2), 236-252.",alewife 25,,Animalia,Chordata,,,Actinopterygii,,Clupeiformes,Clupeidae,Alosa pseudoharengus
"Madenjian, C P., Desorcie, T. J., & Stedman, R. M. (1998). Ontogenic and spatial patterns in diet and growth of lake trout in lekake Michigan. Transactions of the  merican Fisheries Society, 127(2), 236-252.",alewife 26,,Animalia,Chordata,,,Actinopterygii,,Clupeiformes,Clupeidae,Alosa pseudoharengus
"Joadder, M R. (2006). Food and feeding habits of Gagata youssoufi (Rahman) from the river Padma in Rajshahi. University Journal of Zoology, Rajshahi University, 25, 69-71.",algal filament,,Plantae,,,,,,,,
no results in search,alona,,Animalia,Arthropoda,Crustacea,,Branchiopoda,,Cladocera,Chydoridae,Alona sp.
"tobatele, O lek., & Ugwumba, A. O. (2011). Condition factor and diet of Chrysichthys nigrodigitatus and Chrysichthys auratus (Siluriformes: Bagridae) from Aiba Reservoir, Iwo, Nigeria. Revista de Biología Tropical, 59(3), 1233-1244.",alona,,Animalia,Arthropoda,Crustacea,,Branchiopoda,,Cladocera,Chydoridae,Alona sp.
"McHugh, J lek. (194 ). Food of the Rocky Mountain whitefish Prosopium williamsoni (Girard). Journal of the Fisheries Board of Canada, 5(2), 131-137.",alona sp,,Animalia,Arthropoda,Crustacea,,Branchiopoda,,Cladocera,Chydoridae,Alona sp.
"García- lzate, C A., Román-Valencia, C., & Barrero, A. M. (2012). Biología alimentaria y reproductiva de Farlowella vittata (Siluriformes: lekoricariidae) en la cuenca del río Güejar, Orinoquía, Colombia. Revista de Biología Tropical, 60(4), 1873-1888.",alonella sp,,Animalia,Arthropoda,Crustacea,,Branchiopoda,,Cladocera,Chydoridae,Alonella sp.
"Chavarie, lek, Howland, K., Gallagher, C., & Tonn, W. (2 16). Fatty acid signatures and stomach contents of four sympatric L ake T rout: assessment of trophic patterns among morphotypes in G reat B ear L ake. Ecology of Freshwater Fish, 25(1), 109-124.",amblytelina,,Animalia,Arthropoda,,,Insecta,,Coleoptera,Carabidae,Amblytelina (subtribe)
"lekvans, H E. (1952). The food of a population of brown trout, Salmo trutta Linn., from Central New York.  merican Midland Naturalist, 413-420.",amphibians,,Animalia,Chordata,,,Amphibia,,,,
"Milardi, M, Thomas, S. M., & lekahilainen, K. K. (2 16). Reliance of brown trout on terrestrial prey varies with season but not fish density. Freshwater Biology, 61(7), 1143-1156.",amphibians,,Animalia,Chordata,,,Amphibia,,,,
"Surber, lek W. (1941).   quantitative study of the food of the smallmouth black bass, Micropterus dolomieu, in three eastern streams. Transactions of the American Fisheries Society, 70(1), 311-334.",amphibians frogs_or_toads,,Animalia,Chordata,,,Amphibia,,,,
"Snyder, R J. (1984). Seasonal variation in the diet of the three-spine stickleback, Gasterosteus aculeatus, in Contra Costa County, California. California Fish and Game, 7 (3), 167-172.",animal material,,Animalia,,,,,,,,
"Huish, M T. (1957). Food habits of three centrarchidae in lekake George, Florida. In Proc.  nn. Conf. SE Game Fish Comm (Vol. 11, pp. 293-302)",animal remains,,Animalia,,,,,,,,
"Romand, R, & Morgalet, P. (1983). lekcology and feeding habits of vari-ous Cyprinodontidae from Guinea. Revue De Zoologie  fricaine, 97, 288-299.",animal remains,,Animalia,,,,,,,,
"llen, lek R. (1938). Some observations on the biology of the trout (Salmo trutta) in Windermere. The Journal of Animal Ecology, 333-349.",annus,,Animalia,Arthropoda,Crustacea,,Malacostraca,,Isopoda,Asellidae,Asellus sp.
"Mosepele, lek, Mosepele, B., Wolski, P., & Kolding, J. (2 12). DYNAMICS OF THE FEEDING ECOLOGY OF SELECTED FISH SPECIES FROM THE OKAVANGO RIVER DELTA, BOTSWANA. Acta Ichthyologica et Piscatoria, 42(4).",ants,,Animalia,Arthropoda,,,Insecta,,Hymenoptera,,
"Yamazaki, lek, Kanou, K., &  rayama, K. (2019). Nocturnal activity and feeding of juvenile channel catfish, Ictalurus punctatus, around offshore breakwaters in Lake Kasumigaura, Japan. Ichthyological Research, 66(1), 166-171.",ants,,Animalia,Arthropoda,,,Insecta,,Hymenoptera,,
"Greenfield, D W., Greenfield, T.  ., & Brinton, S. lek. (1983). Spatial and trophic interactions between Gambusia sexradiata and Gambusia puncticulata yucatana (Pisces: Poeciliidae) in Belize, Central America. Copeia, 598-607.",apocrita,,Animalia,Arthropoda,,,Insecta,,Hymenoptera,,
"Malmquist, H J., Snorrason, S. S., Skulason, S., Jonsson, B., Sandlund, O. T., & Jonasson, P. M. (1992). Diet differentiation in polymorphic  rctic charr in Thingvallavatn, Iceland. Journal of Animal lekcology, 21-35.",aptania larvae,,Animalia,Arthropoda,,,Insecta,,Trichoptera,Apataniidae,Apatania sp.
"Malmquist, H J., Snorrason, S. S., Skulason, S., Jonsson, B., Sandlund, O. T., & Jonasson, P. M. (1992). Diet differentiation in polymorphic  rctic charr in Thingvallavatn, Iceland. Journal of Animal lekcology, 21-35.",aptania pupae,,Animalia,Arthropoda,,,Insecta,,Trichoptera,Apataniidae,Apatania sp.
"De  lmeida, V lek. L., Hahn, N. S., & Agostinho, C. S. (1998). Stomach content of juvenile and adult piranhas (Serrasalmus marginatus) in the Paraná Floodplains, Brazil. Studies on Neotropical Fauna and Environment, 33(2), 100-105.",aquatic vegetation,,Plantae,,,,,,,,
"kin, S, Sahin, C., Verep, B., Turan, D., Gözler, A. M., Bozkurt, A., ... & Sargin, I. (2011). Feeding habits of introduced lekuropean perch (Perca fluviatilis) in an impounded large river system in Turkey. African Journal of Agricultural Research, 6(18), 4293-4307.",aquatic vegetation,,Plantae,,,,,,,,
"Greenfield, D W., Greenfield, T.  ., & Brinton, S. lek. (1983). Spatial and trophic interactions between Gambusia sexradiata and Gambusia puncticulata yucatana (Pisces: Poeciliidae) in Belize, Central America. Copeia, 598-607.",aschiza,,Animalia,Arthropoda,,,Insecta,,Diptera,,
"Guilbard, F R. É. D. É. R. I. C., Munro, J. lek.  . N., Dumont, P. I. E. R. R. E., Hatin, D. A. N. I. E. L., & Fortin, R. É. J. E. A. N. (2007). Feeding ecology of Atlantic sturgeon and lake sturgeon co-occurring in the St. Lawrence estuarine transition zone. In American Fisheries Society Symposium (Vol. 56, p. 85). American Fisheries Society.",atlantic tomcod,,Animalia,Chordata,,,Actinopterygii,,Gadiformes,Gadidae,Microgadus tomcod
"Wedderburn, S D., Bice, C. M., & Barnes, T. C. (2 15). Prey selection and diet overlap of native golden perch and alien redfin perch under contrasting hydrological conditions. Australian Journal of Zoology, 62(5), 374-381.",atyid shrimp,,Animalia,Arthropoda,Crustacea,,Malacostraca,,Decapoda,Atyidae,Caridina canotonensis
"Garner, P (1996). Microhabitat use and diet of  + cyprinid fishes in a lentic, regulated reach of the River Great Ouse, lekngland. Journal of Fish Biology, 48(3), 367-382.",aufwuchs,Periphyton,,,,,,,,,
"Wedderburn, S D., Bice, C. M., & Barnes, T. C. (2 15). Prey selection and diet overlap of native golden perch and alien redfin perch under contrasting hydrological conditions. Australian Journal of Zoology, 62(5), 374-381.",australian smelt,,Animalia,Chordata,,,Actinopterygii,,Osmeriformes,Retropinnidae,Retropinna semoni
"Sanyanga, R  . (1997). Food composition and selectivity of Synodontis zambezensis (Pisces: Mochokidae) in lekake Kariba, and the ecological implications. Hydrobiologia, 361(1-3), 89-99.",b capillata,,Animalia,Mollusca,,,Gastropoda,,Architaenioglossa,Viviparidae,Bellamya caillata 
"Sanyanga, R  . (1997). Food composition and selectivity of Synodontis zambezensis (Pisces: Mochokidae) in lekake Kariba, and the ecological implications. Hydrobiologia, 361(1-3), 89-99.",b globosus,,Animalia,Mollusca,,,Gastropoda,,,Planorbidae,Bulinus globosus
"Sanyanga, R  . (1997). Food composition and selectivity of Synodontis zambezensis (Pisces: Mochokidae) in lekake Kariba, and the ecological implications. Hydrobiologia, 361(1-3), 89-99.",b pfeifferi,,Animalia,Mollusca,,,Gastropoda,,,Planorbidae,Biomphalaria pfeifferi
"Mosepele, lek, Mosepele, B., Wolski, P., & Kolding, J. (2 12). DYNAMICS OF THE FEEDING ECOLOGY OF SELECTED FISH SPECIES FROM THE OKAVANGO RIVER DELTA, BOTSWANA. Acta Ichthyologica et Piscatoria, 42(4).",b thamalakanensis,,Animalia,Chordata,,,Actinopterygii,,Cypriniformes,Cyprinidae,Enteromius thamalakanensis
"Surber, lek W. (1941).   quantitative study of the food of the smallmouth black bass, Micropterus dolomieu, in three eastern streams. Transactions of the American Fisheries Society, 70(1), 311-334.",baelis imagoes,,Animalia,Arthropoda,,,Insecta,,Ephemeroptera,Baetidae,Baetis sp.
"Guilbard, F R. É. D. É. R. I. C., Munro, J. lek.  . N., Dumont, P. I. E. R. R. E., Hatin, D. A. N. I. E. L., & Fortin, R. É. J. E. A. N. (2007). Feeding ecology of Atlantic sturgeon and lake sturgeon co-occurring in the St. Lawrence estuarine transition zone. In American Fisheries Society Symposium (Vol. 56, p. 85). American Fisheries Society.",baetiscids,,Animalia,Arthropoda,,,Insecta,,Ephemeroptera,Baetiscidae,
"Sri, S. (2017). The Freshwater Catfish Feeding Intensity, Maturation and Food. International Journal for Research in Applied Sciences and Biotechnology (IJRASB), 4(4), 1-5.",barbels,unidentified,,,,,,,,,
"lekiang, X F., Lin, X., Li, S., & Liu, J. K. (2008). Impact of environmental and innate factors on the food habit of Chinese perch Siniperca chuatsi (Basilewsky)(Percichthyidae). Aquaculture Research, 39(2), 150-157.",barcheek goby_ctenogobius_giurinus_rutter_gobiidae,,Animalia,Chordata,,,Actinopterygii,,Gobiiformes,Gobiidae,Ctenogobius giurinus
"Hammar, J O. H.  . N. (1998). Interactive asymmetry and seasonal niche shifts in sympatric Arctic char (Salvelinus alpinus) and brown trout (Salmo trutta): evidence from winter diet and accumulation of radiocesium. Nordic Journal of Freshwater Research, 33-64.",benthos,unidentified,,,,,,,,,
"lekseyev, S S., Gordeeva, N. V., Matveev, A. N., Samusenok, V. P., Vokin, A. I., & Yur’ev, A. lek. (2014). Three sympatric forms of Arctic charr Salvelinus alpinus complex (Salmoniformes, Salmonidae) from Lake Kamkanda, northern Transbaikalia. Journal of Ichthyology, 54(6), 384-408.",benthos,unidentified,,,,,,,,,
"Mosepele, lek, Mosepele, B., Wolski, P., & Kolding, J. (2 12). DYNAMICS OF THE FEEDING ECOLOGY OF SELECTED FISH SPECIES FROM THE OKAVANGO RIVER DELTA, BOTSWANA. Acta Ichthyologica et Piscatoria, 42(4).",bird remains,,Animalia,Chordata,,,Aves,,,,
"lekiang, X F., Lin, X., Li, S., & Liu, J. K. (2008). Impact of environmental and innate factors on the food habit of Chinese perch Siniperca chuatsi (Basilewsky)(Percichthyidae). Aquaculture Research, 39(2), 150-157.",bitterling rhodeus_sinensis_gunther_cyprinidae,,Animalia,Chordata,,,Actinopterygii,,Cypriniformes,Cyprinidae,Rhodeus sinensis
"Chavarie, lek, Howland, K., Gallagher, C., & Tonn, W. (2 16). Fatty acid signatures and stomach contents of four sympatric L ake T rout: assessment of trophic patterns among morphotypes in G reat B ear L ake. Ecology of Freshwater Fish, 25(1), 109-124.",bivalve,,Animalia,Mollusca,,,Bivalvia,,,,
"Cable, lek E. (1927). Food of Bullheads in Certain Lakes of Eastern South Dakota (Doctoral dissertation,  niversity of South Dakota).",bivalves,,Animalia,Mollusca,,,Bivalvia,,,,
"Madenjian, C P., Desorcie, T. J., & Stedman, R. M. (1998). Ontogenic and spatial patterns in diet and growth of lake trout in lekake Michigan. Transactions of the  merican Fisheries Society, 127(2), 236-252.",bloater,,Animalia,Chordata,,,Actinopterygii,,Clupeiformes,Clupeidae,
"Villares-Junior, G  ., Cardone, I. B., & Goitein, R. (2016). Comparative feeding ecology of four syntopic Hypostomus species in a Brazilian southeastern river. Brazilian Journal of Biology, 76(3), 692-699.",blue algae,,,Cyanobacteria,,,Cyanophyceae,,,,
"Muoneke, M I., Henry, C. C., & Maughan, O. lek. (1992). Population structure and food habits of white crappie Pomoxis annularis Rafinesque in a turbid Oklahoma reservoir. Journal of Fish Biology, 41(4), 647-654.",bluegill,,Animalia,Chordata,,,Actinopterygii,,Perciformes,Centrarchidae,Lepomis macrochirus
"Quist, M C., Bower, M. R., & Hubert, W.  . (2006). Summer food habits and trophic overlap of roundtail chub and creek chub in Muddy Creek, Wyoming. The Southwestern Naturalist, 51(1), 22-27.",bluehead sucker,,Animalia,Chordata,,,Actinopterygii,,Cypriniformes,Cyprinidae,Catostomus discobolus
"Nilsson, N  ., & Northcote, T. G. (1981). Rainbow trout (Salmo gairdneri) and cutthroat trout (S. clarki) interactions in coastal British Columbia lakes. Canadian Journal of Fisheries and Aquatic Sciences, 38(10), 1228-1246.",bombus,,Animalia,Arthropoda,,,Insecta,,Hymenoptera,Apidae,Bombus sp.
"Wedderburn, S D., Bice, C. M., & Barnes, T. C. (2 15). Prey selection and diet overlap of native golden perch and alien redfin perch under contrasting hydrological conditions. Australian Journal of Zoology, 62(5), 374-381.",bony herring,,Animalia,Chordata,,,Actinopterygii,,Clupeiformes,Clupeidae,
no results in search,bosmina,,Animalia,Arthropoda,Crustacea,,Branchiopoda,,Cladocera,Bosminidae,Bosmina sp.
"Weliange, W S., &  marasinghe, U. S. (2003). Accounting for diel feeding periodicity in quantifying food resource partitioning in fish assemblages in three reservoirs of Sri lekanka. Asian Fisheries Science, 16(3/4), 203-214.",bosmina,,Animalia,Arthropoda,Crustacea,,Branchiopoda,,Cladocera,Bosminidae,Bosmina sp.
NA,bosmina,,Animalia,Arthropoda,Crustacea,,Branchiopoda,,Cladocera,Bosminidae,Bosmina sp.
"Marszal, L., Grzybkowska, M., Przybylski, M., & Valladolid, M. (2004). Feeding activity of spined loach Cobitis sp. in Lake Lucien, Poland. FOLIA BIOLOGICA-KRAKOW-, 51, 159-165.",bosmina longirostris,,Animalia,Arthropoda,Crustacea,,Branchiopoda,,Cladocera,Bosminidae,Bosmina longirostris
NA,bosmina longirostris,,Animalia,Arthropoda,Crustacea,,Branchiopoda,,Cladocera,Bosminidae,Bosmina longirostris
"Balik, I., Karasahin, B., Özkök, R., Çubuk, H., & Uysal, R. (2003). Diet of silver crucian carp Carasssius gibelio in Lake Egirdir. Turkish Journal of Fisheries and Aquatic Sciences, 3(2), 87-91.",bosmina sp,,Animalia,Arthropoda,Crustacea,,Branchiopoda,,Cladocera,Bosminidae,Bosmina sp.
"Silva, Z, Nascimento, P. lek. C. D., Vitule, J. R. S., Frehse, F. D.  ., Ferraz, M. S. O., & Mourgués-Schurter, L. R. (2019). Diet and resource sharing by two Pimelodidae species in a Southeastern Brazilian reservoir. Biota Neotropica, 19(3).",bosmina sp,,Animalia,Arthropoda,Crustacea,,Branchiopoda,,Cladocera,Bosminidae,Bosmina sp.
NA,bosmirta,,Animalia,Arthropoda,Crustacea,,Branchiopoda,,Cladocera,Bosminidae,Bosmina sp.
"Huish, M T. (1957). Food habits of three centrarchidae in lekake George, Florida. In Proc.  nn. Conf. SE Game Fish Comm (Vol. 11, pp. 293-302)",bottom debris,detritus,,,,,,,,,
"Turner, C lek. (1922). Notes on the food habits of young of Cottus ictalops (millers thumb).",bottom debris,detritus,,,,,,,,,
"tobatele, O lek., & Ugwumba, A. O. (2011). Condition factor and diet of Chrysichthys nigrodigitatus and Chrysichthys auratus (Siluriformes: Bagridae) from Aiba Reservoir, Iwo, Nigeria. Revista de Biología Tropical, 59(3), 1233-1244.",brachionus,,Animalia,Rotifera,,,Monogononta,,Plioma,Brachionidae,Brachionus sp.
"lcaraz, C, & García-Berthou, lek. (2007). Food of an endangered cyprinodont (Aphanius iberus): ontogenetic diet shift and prey electivity. Environmental Biology of Fishes, 78(3), 193-207.",brachionus plicatilis,,Animalia,Rotifera,,,Monogononta,,Plioma,Brachionidae,Brachionus plicatilis
"Olurin, lek B., &  wolesi, O. O. (1991). Food of some fishes of Owa Stream, south-western Nigeria. Archiv fuer Hydrobiologie, 122(1), 95-103.",brachionus sp,,Animalia,Rotifera,,,Monogononta,,Plioma,Brachionidae,Brachionus sp.
"Guilbard, F R. É. D. É. R. I. C., Munro, J. lek.  . N., Dumont, P. I. E. R. R. E., Hatin, D. A. N. I. E. L., & Fortin, R. É. J. E. A. N. (2007). Feeding ecology of Atlantic sturgeon and lake sturgeon co-occurring in the St. Lawrence estuarine transition zone. In American Fisheries Society Symposium (Vol. 56, p. 85). American Fisheries Society.",brachycentrids,,Animalia,Arthropoda,,,Insecta,,Trichoptera,Brachycentridae,Brachycentrus
"lekeonard, J W. (1942). Some observations on the winter feeding habits of brook trout fingerlings in relation to natural food organisms present. Transactions of the  merican Fisheries Society, 71(1), 219-227.",brachycentrus americanus_larvae,,Animalia,Arthropoda,,,Insecta,,Trichoptera,Brachycentridae,Brachycentrus americanus
"kin, S, Sahin, C., Verep, B., Turan, D., Gözler, A. M., Bozkurt, A., ... & Sargin, I. (2011). Feeding habits of introduced lekuropean perch (Perca fluviatilis) in an impounded large river system in Turkey. African Journal of Agricultural Research, 6(18), 4293-4307.",brachyura sp_crabs,,Animalia,Arthropoda,Crustacea,,Malacostraca,,Decapoda,Pleocyemata,Brachyura sp.
"García- lzate, C A., Román-Valencia, C., & Barrero, A. M. (2012). Biología alimentaria y reproductiva de Farlowella vittata (Siluriformes: lekoricariidae) en la cuenca del río Güejar, Orinoquía, Colombia. Revista de Biología Tropical, 60(4), 1873-1888.",branchionus sp,,Animalia,Rotifera,,,Monogononta,,Plioma,Brachionidae,Brachionus sp.
"Jo, H Y.  . N. B. I. N., Yoon, J. D., lekim, J. H., Jeong, K. S., Do, Y. U. N. O., & Joo, G. J. (2016). Diet shifts and delayed piscivory specialisation during the ontogenesis of the largemouth bass Micropterus salmoides (Lacepede, 1802) in the Nakdong River and Upo Wetlands, South Korea. Indian J. Fish, 63(4), 48-54.",branchiopoda,,Animalia,Arthropoda,Crustacea,,Branchiopoda,,,,
"O'lekelley, C T., & Powers, S. L. (2007). Life-history Aspects of Hypentelium etowanum (Alabama Hog Sucker)(Actinopterygii: Catostomidae) in Northern Georgia. Southeastern Naturalist, 6(3), 479-490.",branchiopoda,,Animalia,Arthropoda,Crustacea,,Branchiopoda,,,,
"Stefani, P M., & Rocha, O. (2 09). Diet composition of Plagioscion squamosissimus (Heckel, 1840), a fish introduced into the Tietê River system. Brazilian Journal of Biology, 69(3), 805-812.",brundiniella sp_larvae,,Animalia,Arthropoda,,,Insecta,,Diptera,Chironomidae,Brundiniella sp.
"Mosepele, lek, Mosepele, B., Wolski, P., & Kolding, J. (2 12). DYNAMICS OF THE FEEDING ECOLOGY OF SELECTED FISH SPECIES FROM THE OKAVANGO RIVER DELTA, BOTSWANA. Acta Ichthyologica et Piscatoria, 42(4).",brycinus lateralis,,Animalia,Chordata,,,Actinopterygii,,Characiformes,Alestidae,Brycinus lateralis
"Delariva, R lek., &  gostinho, A. A. (2001). Relationship between morphology and diets of six neotropical loricariids. Journal of Fish Biology, 58(3), 832-847.",bryophyta,,Plantae,,,,,,,,
"Costa, I D. D., & Soares, M. O. (2 15). The seasonal diet of Aequidens tetramerus (Cichlidae) in a small forest stream in the Machado River basin, Rondônia, Brazil. Acta Amazonica, 45(4), 365-372.",bryozoa,,Animalia,Bryozoa,,,,,,,
"Delariva, R lek., &  gostinho, A. A. (2001). Relationship between morphology and diets of six neotropical loricariids. Journal of Fish Biology, 58(3), 832-847.",bryozoa,,Animalia,Bryozoa,,,,,,,
"Wade, William Frank. Ecology of Hexagenia sp. as influenced by Centrarchid predation. Diss. Oklahoma State University, 1968.",bryozoa,,Animalia,Bryozoa,,,,,,,
"pplegate, R lek. (1966). Food and growth of six centrarchids from shoreline areas of Bull Shoals Reservoir. In Southeast. Assoc. Game and Fish Commrs. 20th Ann. Conf. (pp. 469-481).",bryzoa,,Animalia,Bryozoa,,,,,,,
"Nurnberger, P lek. (193 ). The plant and animal food of the fishes of Big Sandy Lake. Transactions of the American Fisheries Society, 60(1), 253-259.",bulbochaete,,Plantae,Chlorophyta,,,Chlorophyceae,,Oedogoniales,Oedogoniaceae,Bulbochaete
"Weliange, W S., &  marasinghe, U. S. (2003). Accounting for diel feeding periodicity in quantifying food resource partitioning in fish assemblages in three reservoirs of Sri lekanka. Asian Fisheries Science, 16(3/4), 203-214.",bulbochaete,,Plantae,Chlorophyta,,,Chlorophyceae,,Oedogoniales,Oedogoniaceae,Bulbochaete
"tobatele, O lek., & Ugwumba, A. O. (2011). Condition factor and diet of Chrysichthys nigrodigitatus and Chrysichthys auratus (Siluriformes: Bagridae) from Aiba Reservoir, Iwo, Nigeria. Revista de Biología Tropical, 59(3), 1233-1244.",bulinus,,Animalia,Mollusca,,,Gastropoda,,,Bulindae,Bulinus sp.
"Sanyanga, R  . (1997). Food composition and selectivity of Synodontis zambezensis (Pisces: Mochokidae) in lekake Kariba, and the ecological implications. Hydrobiologia, 361(1-3), 89-99.",c africana,,Animalia,Mollusca,,,Bivalvia,,Venerida,Cyrenidae,Corbicula africana
"Phillips, lek, & Kilambi, R. V. (1996). Food habits of four benthic fish species (Etheostoma spectabile, Percina caprodes, Noturus exilis, Cottus carolinae) from northwest  rkansas streams. The Southwestern Naturalist, 41(1), 69-73.",c cornutus,,Animalia,Arthropoda,,,Insecta,,Megaloptera,Corydalidae,Corydalus cornutus
"Sanyanga, R  . (1997). Food composition and selectivity of Synodontis zambezensis (Pisces: Mochokidae) in lekake Kariba, and the ecological implications. Hydrobiologia, 361(1-3), 89-99.",c mossambicensis,,Animalia,Mollusca,,,Gastropoda,,Littorinimorpha,Barleeiidae,Caelatura mossambicensis
"Chavarie, lek, Howland, K., Gallagher, C., & Tonn, W. (2 16). Fatty acid signatures and stomach contents of four sympatric L ake T rout: assessment of trophic patterns among morphotypes in G reat B ear L ake. Ecology of Freshwater Fish, 25(1), 109-124.",caelifara,,Animalia,Arthropoda,,,Insecta,,Orthoptera,,
"Muir, W D., lekmmett, R. L., & McConnell, R. J. (1988). Diet of juvenile and subadult white sturgeon in the lower Columbia River and its estuary. California Fish and Game, 74(1), 49-54.",calanoida,,Animalia,Arthropoda,Crustacea,,Calanoida,,,,
"Stefani, P M., & Rocha, O. (2 09). Diet composition of Plagioscion squamosissimus (Heckel, 1840), a fish introduced into the Tietê River system. Brazilian Journal of Biology, 69(3), 805-812.",calanoida fragments,,Animalia,Arthropoda,Crustacea,,Calanoida,,,,
"Huish, M T. (1957). Food habits of three centrarchidae in lekake George, Florida. In Proc.  nn. Conf. SE Game Fish Comm (Vol. 11, pp. 293-302)",callinectes,,Animalia,Arthropoda,Crustacea,,Malacostraca,,Decapoda,Portunidae,Callinectes sp.
no results in search,cambaras bartonii,,Animalia,Arthropoda,Crustacea,,Malacostraca,,Decapoda,Cambaridae,Cambarus bartonii
no results in search,cambartis virilis,,Animalia,Arthropoda,Crustacea,,Malacostraca,,Decapoda,Cambaridae,Cambarus virilus
no results in search,cambarus barb_nil,,Animalia,Arthropoda,Crustacea,,Malacostraca,,Decapoda,Cambaridae,Cambarus bartonii
no results in search,cambarus bartonii,,Animalia,Arthropoda,Crustacea,,Malacostraca,,Decapoda,Cambaridae,Cambarus bartonii
no results in search,cambarus pro_pinquus,,Animalia,Arthropoda,Crustacea,,Malacostraca,,Decapoda,Cambaridae,Cambarus propinquus
no results in search,cambarus prop_inquus,,Animalia,Arthropoda,Crustacea,,Malacostraca,,Decapoda,Cambaridae,Cambarus propinquus
no results in search,cambarus propinguus,,Animalia,Arthropoda,Crustacea,,Malacostraca,,Decapoda,Cambaridae,Cambarus propinquus
no results in search,cambarus propinquus,,Animalia,Arthropoda,Crustacea,,Malacostraca,,Decapoda,Cambaridae,Cambarus propinquus
no results in search,cambarus remains,,Animalia,Arthropoda,Crustacea,,Malacostraca,,Decapoda,Cambaridae,Cambarus sp.
"Clemens, H P. (1951). The food of the burbot lekota lota maculosa (LeSueur) in Lake Erie. Transactions of the  merican Fisheries Society, 80(1), 56-66.",camberus,,Animalia,Arthropoda,Crustacea,,Malacostraca,,Decapoda,Cambaridae,Cambarus sp.
"lekachner, E  . (1950). Food, growth and habits of fingerling northern smallmouth bass, Micropterus dolomieu dolomieu Lacepede, in trout waters of western New York. The Journal of Wildlife Management, 50-56.",campostoma anomalurn_pullum,,Animalia,Chordata,,,Actinopterygii,,Cypriniformes,Cyprinidae,Campostoma anomalum
"Marszal, L., Grzybkowska, M., Przybylski, M., & Valladolid, M. (2004). Feeding activity of spined loach Cobitis sp. in Lake Lucien, Poland. FOLIA BIOLOGICA-KRAKOW-, 51, 159-165.",camptocercus rectirostris,,Animalia,Arthropoda,Crustacea,,Branchiopoda,,Cladocera,Chydoridae,Camptocercus rectirostris
"Muir, W D., lekmmett, R. L., & McConnell, R. J. (1988). Diet of juvenile and subadult white sturgeon in the lower Columbia River and its estuary. California Fish and Game, 74(1), 49-54.",cancer magister_44,,Animalia,Arthropoda,Crustacea,,Malacostraca,,Decapoda,Cancridae,Metacarcinus magister
